{
  "version": "1.0",
  "taskId": "",
  "userGoal": "",
  "scope": {
    "inScope": [],
    "outOfScope": [],
    "assumptions": [],
    "openQuestions": []
  },
  "design": {
    "components": [],
    "extensionPoints": [],
    "rejectedAlternatives": []
  },
  "pseudocode": {
    "draft": "",
    "reviewFindings": [],
    "approved": false
  },
  "implementation": {
    "changedFiles": [],
    "testsAddedOrUpdated": [],
    "knownRisks": []
  },
  "docs": {
    "designDocUpdated": false,
    "diagramsUpdated": false,
    "docChanges": []
  }
}
